category,date,source,title,link,description,hits
나프타,2026-06-02,뉴스1,"김정관 ""8월 원유, 7월 중 평시 80% 수준 중반까지 확보 가능""…위기설 ...",https://www.news1.kr/economy/idustry-trade/6185282,"나프타 가동률은 5월 말 기준 약 75%로 회복됐다""며 ""전쟁 전 평시 수준 80%를 고려하고, 나프타에 대한 수출 제한을 감안하면 사실상 정상적 수준에서 가동되고 있다""고 설명했다. 이어 천연가스 수급과 관련해서도... ",33
나프타,2026-06-02,머니투데이,중동발 물가 압박 속 농축산물 1.8%↑…축산물 5.8% 상승,https://www.mt.co.kr/economy/2026/06/02/2026060209321379837,"유가와 나프타 등 원자재 가격 상승 가능성에 대비해 세제·자금 지원을 지속하고 업계와의 협력을 강화할 계획이다. 박정훈 식량정책실장은 ""여름철 기상이변과 국제정세 불안 등 대외 불확실성이 큰 만큼 품목별 수급... ",17
나프타,2026-06-02,연합뉴스,"조현, 아프리카 17개국 외교장관과 연쇄회담…협력 논의(종합)",https://www.yna.co.kr/view/AKR20260602104351504?input=1195m,특히 조 장관은 한국의 제2위 나프타 공급국이자 제11위 원유 공급국인 알제리와 에너지 분야 협력 확대를 위해 함께 노력해 나가길 희망했다. 아타프 장관은 한국 기업들의 대알제리 원유 투자 진출을 환영하는 한편 한국... ,7
나프타,2026-06-02,이데일리,"무신사, 친환경 포장 도입한다…그리코와 맞손",https://www.edaily.co.kr/news/newspath.asp?newsid=04559206645477784,이번 협약은 정부의 ‘탈플라스틱 순환경제 전환 추진계획’에 선제적으로 대응하는 동시에 최근 중동 정세 불안으로 수급이 불안정해진 나프타 대신 친환경 소재를 확보할 필요가 커진 데 따라 추진됐다. 무신사는 이번... ,6
나프타,2026-06-02,파이낸셜뉴스,농산물 0.8% ↓ 축산물 5.8% ↑...전염병 영향,http://www.fnnews.com/news/202606021059070038,"농축산물 수급안정대책반'을 구성했다. 2일 농식품부에 따르면 농산물은 양배추, 당근, 양파, 배추 등 대다수... 가공식품과 외식 물가는 안정적이나, 농식품부는 중동상황 장기화에 따른 유가 및 나프타 등 원자재 가격... ",6
나프타,2026-06-02,비즈니스포스트,"산업장관 김정관 8월 원유 수급 위기설에 선 그어, ""납사 가동률도 정상...",https://www.businesspost.co.kr/BP?command=article_view&num=439143,"김 장관은 2일 청와대에서 열린 국무회의에서 ""민·관이 함께 노력한 결과 에너지 수급상황은 안정적으로... 김 장관은 원유뿐 아니라 석유화학산업의 원료인 나프타(납사) 또한 평상시 수준으로 안정적 흐름을 이어가고... ",7
나프타,2026-06-02,매일경제,"불닭 반도체, 진짜 반도체엔 안되네…삼양식품 9거래일째 급락",https://www.mk.co.kr/article/12064404,미국과 이란 전쟁 이후 국제유가와 환율이 뛰면서 수입물가 부담이 커졌고 나프타 가격도 급등했다.... 현재 글로벌 공급 부족으로 매출 증가폭이 실제 늘어나는 수요를 충분히 따라가지 못하고 있는 만큼 생산능력... ,5
원유,2026-06-02,이데일리,"韓, 캐나다산 원유 도입 확대…LNG·핵심광물 협력↑",https://www.edaily.co.kr/news/newspath.asp?newsid=06113926645477784,한국이 캐나다산 원유 도입량을 올해 3.3배까지 확대하기로 했다. 향후 연간 최대 2000만배럴까지 늘려가는... 캐나다 서부에서 선적된 LNG는 13일 만에 한국에 도착할 수 있어 수급 안정에도 기여할 것으로 기대된다.... ,28
원유,2026-06-02,서울경제,"김정관 “8월 원유, 80% 중반 확보될 것”…‘8월 위기설’ 일축",https://www.sedaily.com/article/20051146?ref=naver,그동안 시장 일각에서는 중동 전쟁으로 인한 호르무즈해협 봉쇄가 더 길어질 경우 8월께 원유 수급 위기가 발생할 수 있다는 우려를 제기한 바 있다. 날이 무더워지는 7~8월에는 에어컨 가동 등 전력 수요가 늘기... ,24
원유,2026-06-02,뉴시스,중동 공급 불안에 美 5월 원유 수출 사상 최대…베네수도 회복세,https://www.newsis.com/view/NISX20260602_0003653073,미국과 이란의 전쟁으로 중동 지역 원유 공급망이 흔들리면서 지난달 미국의 원유 수출량이 역대 최고치를 경신했다. 아시아와 유럽 정유사들이 중동 의존도를 줄이기 위해 미국산 원유 확보에 나선 영향이다. 1일... ,19
원유,2026-06-02,매일경제,"산업부, 캐나다서 원유 1600만 배럴·LNG 340만 톤 확보...강훈식 비서실...",https://www.mk.co.kr/article/12064526,캐나다산 원유 도입 물량을 전년 대비 3배 이상 확대하는 방안을 추진한다. 중동 의존도를 낮추고 에너지 수급의 안정성을 확보하기 위한 전략적 선택으로 풀이된다. 2일 산업통상부는 캐나다 오타와에서 열린 ‘한... ,11
원유,2026-06-02,서울경제,"삼성重, 4.3조원 규모 美루이지애나 FLNG 1기 수주",https://www.sedaily.com/article/20051022?ref=naver,"삼성중공업은 북미 지역 발주처로부터 부유식 액화천연가스 생산설비(FLNG) 1기를 4조 3301억 원에... 2척, 원유운반선 6척 등 50억 달러로 수주목표 57억 달러의 88%, 해양 부문은 FLNG 1기 등 33억 달러로 수주목표 82억... ",9
원유,2026-06-02,아시아경제,"캐나다 방문한 '방산 특사' 강훈식 ""조달속도·품질·납기 갖춘 유일 파...",https://view.asiae.co.kr/article/2026060217150943013,"(LNG), 원유 등을 협력 분야로 제시하며 ""함께 피를 흘린 혈맹인 만큼 다음 세대를 위해서도 함께 싸워나가자... 그는 ""우리 경제의 미래 성장동력을 창출하고 국제정세의 변화에도 흔들리지 않는 안정적인 에너지 수급구조... ",10
원유,2026-06-03,한국경제,"韓, 캐나다 원유 수입…잠수함 수주 총력전",https://www.hankyung.com/article/2026060239741,자원 공급망 협력 포럼’에서 합의한 경제협력에 따라 지난해 488만 배럴인 한국의 캐나다산 원유 수입 규모는 올해 최대 1600만 배럴로 늘어난다. 양국은 앞으로 수입량을 연간 최대 2000만 배럴까지 늘리기로 했다.... ,8
중동영향,2026-06-02,이데일리,이란 “호르무즈 통항 허가 신청 선박 300척 넘어”,https://www.edaily.co.kr/news/newspath.asp?newsid=05733446645477784,"호르무즈 해협은 중동산 원유와 LNG 수송의 핵심 길목이다. 이란이 통항 허가제를 앞세워 선박 이동을 관리하겠다고 나서면서, 에너지 시장과 해상 물류를 둘러싼 긴장도 커지고 있다.",63
중동영향,2026-06-02,서울경제,"김정관 “8월 원유, 80% 중반 확보될 것”…‘8월 위기설’ 일축",https://www.sedaily.com/article/20051146?ref=naver,국제에너지기구(IEA) 역시 중동발 원유 공급 차질과 여름철 수요 증대가 겹쳐 7∼8월에 국제 석유 시장이 위험 구간에 진입할 수 있다고 경고한 바 있다. 한편 정부는 원유 수급과 석유제품 생산 차질을 줄이기 위한... ,26
중동영향,2026-06-02,동아일보,이란 전쟁 여파에 美 5월 원유 수출량 사상 최고… 최대 수입지역은?,https://www.donga.com/news/Inter/article/all/20260602/134036659/1,"이란 전쟁 여파로 중동산 원유 공급에 대한 불안이 커지자, 아시아와 유럽 정유사들이 미국산 원유를 사들였기 때문으로 풀이된다. 1일(현지 시간) 로이터통신이 에너지 분석 기업 케이플러 등의 선박 추적 데이터를... ",23
중동영향,2026-06-02,이데일리,"이란, 미국과 협상 중단 선언…""호르무즈 봉쇄"" 경고[뉴스새벽배송]",https://www.edaily.co.kr/news/newspath.asp?newsid=02689606645477784,이란이 미국과의 종전 협상을 중단하고 세계 원유 수송의 핵심 통로인 호르무즈 해협을 전면 봉쇄하겠다고 경고하면서 중동 정세가 다시 긴장 국면으로 치닫고 있다. 도널드 트럼프 미국 대통령.(사진=AFP) 이란... ,19
중동영향,2026-06-03,동아일보,트럼프 또 종전 ‘희망고문’… 강경파 반발속 “1주내 MOU 합의”,https://www.donga.com/news/Inter/article/all/20260602/134039176/2,도널드 트럼프 미국 대통령이 1일 ABC방송 인터뷰에서 이란이 봉쇄 중인 원유 수송로 호르무즈 해협의 재개방 등이 포함된 이란과의 종전을 위한 양해각서(MOU)가 “일주일 안에 합의될 것”이라고 밝혔다. MOU가 체결될... ,18
중동영향,2026-06-02,비즈니스포스트,"국제유가 상승, 미국 이란 종전 협상 중단 소식에 영향 받아",https://www.businesspost.co.kr/BP?command=article_view&num=439064,"1일(현지시각) 미국 뉴욕상업거래소에서 7월물 서부텍사스산 원유(WTI)는 직전거래일보다 5.49%(4.80달러) 오른... 김유미 키움증권 연구원은 ""국제유가는 미국과 이란의 종전 협상이 중단됐다는 소식에 상승했다""고 말했다.... ",19
중동영향,2026-06-03,이데일리,트럼프·루비오 “이란과 협상 계속 진행 중”…핵프로그램 협상 가능성...,https://www.edaily.co.kr/news/newspath.asp?newsid=01292326645478112,전날에는 이란 국영 매체 타스님이 이란 협상단이 미국과의 간접 협상을 중단하고 세계 원유 수송의 핵심 통로인 호르무즈 해협을 전면 봉쇄할 것이라고 전하면서 국제유가가 급등하기도 했다. 다만 트럼프 대통령은 전날... ,17
