category,date,source,title,link,description,hits
나프타,2026-07-12,이데일리,M&A 대신 공급망 재편…울산 석화 새판짜기 시동,https://www.edaily.co.kr/news/newspath.asp?newsid=02102486645513864,"원료 공급 체계에도 적지 않은 변화가 예상된다. 이 설비에서는 에틸렌(180만t), 프로필렌(77만t), 부타디엔(20만t), 벤젠(28만t) 등의 기초유분을 생산할 예정이다. 또 정부가 설정한 NCC(나프타분해설비) 감축 목표(최대 370만t)... ",4
나프타,2026-07-12,중앙일보,흑백 포장지까지 등장…日 ‘플라스틱 사랑’ 나프타 대란에 꺾이나,https://www.joongang.co.kr/article/25444331,전쟁 이후 호르무즈해협 봉쇄가 장기화하면서 발생한 나프타 공급 차질이 포장재 가격 상승을 유발해 일본 특유의 플라스틱 개별 포장 문화가 위축될 수 있다는 분석이다. 일본의 플라스틱 개별 포장 문화는 위생과... ,4
나프타,2026-07-13,이데일리,"플라스틱 대란에 200억원 납품대금 인상, 상생협약 효과",https://www.edaily.co.kr/news/newspath.asp?newsid=03542406645514192,중동 전쟁 당시 나프타 수급 불안이 커지면서 플라스틱 대란이 일어난 가운데 원재료 가격 상승분을 반영한 납품대금 조정 등 조치가 효과를 거둔 것으로 나타났다. 사진=중기부 중소벤처기업부는 지난 4월 을지로위원회... ,3
나프타,2026-07-13,머니투데이,"""없어지기 전에 사자""…컬러 복귀에 '흑백' 가루비 품귀 조짐",https://www.mt.co.kr/world/2026/07/13/2026071308084226649,가루비는 앞서 미·이란 전쟁 장기화로 나프타 수급이 불안정해지자 지난 5월 25일 출고분부터 감자칩과 새우칩 등 14개 제품의 포장재를 전면 흑백으로 바꿔 출시했다. 나프타는 비닐과 필름은 물론 인쇄 잉크 등 포장... ,3
나프타,2026-07-12,서울경제,“이럴 줄 알았으면 10봉지 더 살걸”…한정판 된 ‘이 과자’에 日소비...,https://www.sedaily.com/article/20066764?ref=naver,가루비는 미·이란 전쟁 장기화로 나프타 수급이 불안정해지자 지난 5월 25일 출고분부터 감자칩 등 과자 14종의 포장재를 전면 흑백으로 바꿔 출시했다. 나프타는 비닐과 필름은 물론 인쇄 잉크 등 포장 공정 전반에... ,3
나프타,2026-07-13,아시아경제,"""더이상 안 판다, 보이면 바로 사야"" 난리나더니…한정판 된 '이 과자'에...",https://view.asiae.co.kr/article/2026071311203250108,"이번 조치는 미·이란 갈등 장기화로 불안정했던 나프타 수급이 다소 완화된 데 따른 것이다. 나프타는 비닐과 필름, 인쇄 잉크의 용제 및 수지 제조에 쓰이는 핵심 원료로, 포장 공정 전반에 직접적인 영향을 미친다. 앞서... ",4
나프타,2026-07-13,뉴스1,중동발 리스크에 부산 제조업 경기전망 2개 분기 연속 내림세,https://www.news1.kr/local/busan-gyeongnam/6226172,반면 화학·고무(35)는 고유가·고환율에 따른 원료 조달 비용 증가와 수급 차질이 겹치며 전 분기(70)에... 특히 신발제품의 경우 전 분기 대비 30p 내려 합성피혁·합성고무 등 석유화학 기반 원자재 비중이 높은 업종... ,3
원유,2026-07-13,헤럴드경제,7월 수출 298억弗 ‘역대 최대’,https://biz.heraldcorp.com/article/10806877?ref=naver,"글로벌 인공지능(AI) 인프라 투자 붐에 따른 메모리 수요 폭발로 고정가격이 급상승하면서 반도체는... 반도체(49.6%), 원유(19.0%), 가스(24.8%), 기계류(7.8%), 반도체 제조장비(49.5%) 등에서 수입이 늘었다. 에너지(원유... ",39
원유,2026-07-13,아시아경제,"정부, 중동 긴장 재고조에 원유 수급 긴급 점검…""7~8월 도입물량 100% 확...",https://view.asiae.co.kr/article/2026071311161608671,"미국과 이란 간 무력 충돌이 재점화하고 호르무즈 해협을 둘러싼 긴장이 다시 고조되면서 정부가 원유 수급 상황 점검에 나섰다. 산업통상부는 13일 정부세종청사에서 한국석유공사와 대한석유협회, 정유업계, 해운협회... ",14
원유,2026-07-13,헤럴드경제,"7월 초순 수출 298억달러, 한 달 만에 최대치 경신…반도체 193%↑",https://biz.heraldcorp.com/article/10806582?ref=naver,"글로벌 인공지능(AI) 인프라 투자 붐에 따른 메모리 수요 폭발로 고정가격이 급상승하면서 반도체는... 반도체(49.6%), 원유(19.0%), 가스(24.8%), 기계류(7.8%), 반도체 제조장비(49.5%) 등에서 수입이 늘었다. 에너지(원유... ",13
원유,2026-07-13,연합뉴스,원유 수급 긴급점검회의 참석하는 문신학 차관,https://www.yna.co.kr/view/PYH20260713060000013?input=1196m,문신학 산업통상부 차관이 13일 세종시 정부세종청사에서 열린 원유 수급 긴급점검회의에 참석하고 있다. 2026.7.13,11
원유,2026-07-13,뉴스1,원유수급 긴급 점검회의 발언하는 문신학 산업부 차관,https://www.news1.kr/photos/8005310,문신학 산업부 차관이 6일 세종시 정부세종청사에서 정유사 및 대한석유협회 관계자들이 참석한 원유수급 긴급 점검회의를 주재하며 발언하고 있다. 2026.7.13/뉴스1,10
원유,2026-07-13,머니투데이,최고가격 인하로 내린 기름값…중동 변수에 1600원대 복귀 지연,https://www.mt.co.kr/economy/2026/07/13/2026071214563563960,세계 원유 해상 물동량의 핵심 통로인 호르무즈 해협의 공급 차질 우려가 다시 부각되면서 국제유가는 한때 반등했고 기대됐던 유가 하락 속도도 둔화됐다. 이후 OPEC+ 증산에 따른 공급 확대 전망이 힘을 받으며... ,7
원유,2026-07-13,연합뉴스,"호르무즈 긴장 재점화에 정유업계 긴장…""9월 이후 원유 변수""",https://www.yna.co.kr/view/AKR20260710156500003?input=1195m,해협 긴장에 환적 물량 확보도 '비상'…원유 조달비용 상승 우려 미국과 이란 간 긴장이 다시 고조되면서 호르무즈 해협을 둘러싼 불확실성이 커지자 국내 정유업계도 원유 수급 상황을 예의주시하고 있다. 당장 7∼8월... ,7
중동영향,2026-07-13,아시아경제,"정부, 중동 긴장 재고조에 원유 수급 긴급 점검…""7~8월 도입물량 100% 확...",https://view.asiae.co.kr/article/2026071311161608671,"업계의 원유 확보 현황, 유조선 통항 상황 등을 점검했다. 이번 회의는 지난달 미국과 이란 간 종전 양해각서(MOU) 체결 이후 진정 국면을 보였던 중동 정세가 최근 다시 악화한 데 따른 것이다. 이란은 호르무즈 해협... ",71
중동영향,2026-07-12,조선비즈,"이란 호르무즈 재봉쇄 속, 열세번째 韓 유조선 홍해 통과",https://biz.chosun.com/topics/topics_social/2026/07/12/CZZCOT4ZKVDQJNGEAE5CJAESWY/?utm_source=naver&utm_medium=original&utm_campaign=biz,해당 선박은 사우디아라비아 얀부항에서 원유를 적재한 후 홍해를 빠져나왔다. 정부는 미국·이란간 중동전쟁으로 호르무즈 해협이 봉쇄된 이후 대체 항로인 홍해를 통해 국내로 원유를 들여오고 있다. 지난달 19일 양국이... ,42
중동영향,2026-07-13,아시아경제,"트럼프 ""호르무즈 열려 있다""…美, 이란 해협 통제 거점 공습",https://view.asiae.co.kr/article/2026071304025558149,호르무즈 해협은 전쟁 이전 전 세계 원유와 액화천연가스(LNG)의 약 20%가 통과하던 핵심 에너지 수송로다. 해협을 둘러싼 미·이란의 대립이 장기화할 경우 국제유가와 금융시장의 변동성도 더욱 커질 전망이다.,25
중동영향,2026-07-13,동아일보,이란 “원폭 수십개보다 호르무즈가 중요”…통제권 포기 일축,https://www.donga.com/news/Inter/article/all/20260713/134286515/1,"모즈타바 하메네이 이란 최고지도자의 측근인 모흐센 레자이 군사 고문이 중동의 핵심 원유 수송로인 호르무즈 해협에 대해 “수십 개의 원자폭탄보다 더 중요하며, 이란 이슬람공화국은 이를 지켜내겠다”고 밝혔다.... ",20
중동영향,2026-07-13,동아일보,트럼프 “미사일 1000발 장전” 이란 “호르무즈 봉쇄”… 휴전중단 위...,https://www.donga.com/news/Inter/article/all/20260713/134284409/2,중동의 핵심 원유 수송로인 호르무즈 해협 통제를 둘러싸고 갈등을 벌이고 있는 미국과 이란이 지난 일주일 동안 세 번째 공습을 주고받으며 충돌했다. 도널드 트럼프 미 대통령이 10일(현지 시간) ‘휴전 종료’를 선언한... ,20
중동영향,2026-07-13,연합뉴스,"호르무즈 긴장 재점화에 정유업계 긴장…""9월 이후 원유 변수""",https://www.yna.co.kr/view/AKR20260710156500003?input=1195m,해협 긴장에 환적 물량 확보도 '비상'…원유 조달비용 상승 우려 미국과 이란 간 긴장이 다시 고조되면서 호르무즈 해협을 둘러싼 불확실성이 커지자 국내 정유업계도 원유 수급 상황을 예의주시하고 있다. 당장 7∼8월... ,15
중동영향,2026-07-13,에너지경제,"트럼프, 이란 또 폭격…‘국제유가 100달러’ 현실화하나 [이슈+]",https://www.ekn.kr/web/view.php?key=20260713024571809,쿠웨이트 국방부는 전날 해상 원유 시추 시설이 드론 공습을 받았다고 밝혔다. 이란은 또 미국의 개입이 종료될 때까지 호르무즈 해협을 봉쇄하겠다고 선언했다. 아울러 이란 외무부는 이날 성명을 내고 “(미군의)... ,15
