category,date,source,title,link,description,hits
나프타,2026-07-10,머니투데이,"롯데케미칼, 주요 석화 제품 공급가 인하…""중소 고객사 상생 지원""",https://www.mt.co.kr/industry/2026/07/10/2026071009193267281,이번 조치는 산업통상부 주관 '2026년 나프타 수급안정화 지원금'을 활용해 석유화학 원료 가격 변동에 따른 부담을 완화하고 정부 지원 효과가 산업 전반으로 확산될 수 있도록 하는 방향으로 마련됐다. 롯데케미칼은... ,56
나프타,2026-07-09,뉴시스,"日정부, 호르무즈 불안에 나프타 의무 비축 재추진",https://www.newsis.com/view/NISX20260709_0003702637,"나프타 유래 제품 일부는 수급 불안이 실제 산업 현장으로 번졌다. 포장재와 잉크, 도료, 건설 자재 등 생활과 산업에 가까운 품목에서 원료 확보를 걱정하는 목소리가 나왔다. 정부는 나프타를 경제안전보장추진법상... ",9
나프타,2026-07-09,헤럴드경제,여천NCC 금융지원안 이달 말 나온다,https://biz.heraldcorp.com/article/10803574?ref=naver,중동 전쟁으로 원유 수급과 나프타 공급망 안정이 최우선 과제로 떠오른 영향도 컸다. 석화업계를 중심으로 하반기에는 산단별 논의에 진전이 있을 것이라는 관측이 나온다. 금융당국은 후속 프로젝트의 사업재편계획... ,8
나프타,2026-07-10,아주경제,"롯데케미칼, 나프타 지원금 풀어 중소기업 공급가 낮춘다",https://www.ajunews.com/view/20260710095823982,"이번 조치는 산업통상부 주관 '2026년 나프타 수급안정화 지원금'을 활용하여, 석유화학 원료 가격 변동에 따른 부담을 완화하고 정부 지원 효과가 산업 전반으로 확산될 수 있도록 하는 방향으로 마련됐다.... ",6
나프타,2026-07-09,뉴시스,"중동 긴장 재고조 속 사우디 '호르무즈 우회망' 강화…""에쓰오일, 원유...",https://www.newsis.com/view/NISX20260709_0003702441,"최근 중동 지역의 지정학적 긴장이 다시 고조되면서 글로벌 원유 공급망에 대한 우려가 커지고 있다.... TC2C란 원유를 정제하여 나프타를 뽑아내던 기존 방식과 달리, 저부가가치 중유를 직접 석유화학 기초유분... ",6
나프타,2026-07-09,뉴시스,하루아침에 사라진 종전 기대감…중동 전운에 K-푸드·뷰티 '초긴장',https://www.newsis.com/view/NISX20260709_0003702677,"포장재 수급 차질, 물류비 증가, 원재료 가격 상승 등으로 어려움을 겪은 바 있다. 한국식품산업협회에 따르면 포장재의 주요 원료인 나프타 공급량은 중동전쟁 직후인 3~4월 평시 대비 약 70% 수준으로 감소했으나 지난달... ",5
나프타,2026-07-10,뉴시스,"롯데케미칼, LG화학·한화솔루션 이어 제품가 인하…석화업계 상생 확산",https://www.newsis.com/view/NISX20260710_0003703785,"구체적으로 산업통상부 주관 2026년 나프타 수급 안정화 지원금을 활용해 석유화학 원료 가격 변동에 따른 부담을 줄이는 것이다. 정부 지원 효과를 산업 전반에 확산시키는 방향성이다. 롯데케미칼 관계자는 ""제품별 원료... ",4
원유,2026-07-10,이투데이,마이크론이 쏘아 올린 반도체 랠리…뉴욕증시 나스닥 1.3%↑[종합],https://www.etoday.co.kr/news/view/2602280,"미국과 이란의 군사적 충돌로 호르무즈 해협의 완전한 재개방이 지연되면서 공급 차질 우려가 이어지고 있음에도, 인플레이션 상승과 경제 불안이 글로벌 원유 수요를 위축시킬 수 있다는 우려가 부각된 데... ",24
원유,2026-07-10,이투데이,"국제유가, 미·이란 긴장에도 2%↓⋯수요 둔화 우려 부각 [상보]",https://www.etoday.co.kr/news/view/2602270,발표하면서 4년 만에 가장 큰 일일 상승률을 기록했다. 중동 원유 공급 불확실성이 이어지는 가운데 공급 우려를 더욱 키웠기 때문이다. 러시아는 지난해 기준 미국과 사우디아라비아에 이어 세계 3위 원유 생산국이다.,22
원유,2026-07-10,조선비즈,"남양유업, 한·몽 경제사절단 참여 성과… 100억원 수출 협약",https://biz.chosun.com/distribution/food/2026/07/10/OSJFTYNXWNDKDEDT3QP63ZX6GM/?utm_source=naver&utm_medium=original&utm_campaign=biz,유제품 공급 확대를 위한 핵심 파트너 역할을 할 것으로 남양유업은 기대하고 있다. 이번 협력으로 기존 ‘프렌치카페’ 믹스커피 중심이던 협력 범위를 국산 원유 기반 조제분유와 유제품 전반으로 확대할 전망이다.... ,11
원유,2026-07-09,헤럴드경제,“10분 거리만 포장 됩니다”…드라이아이스도 동났다 [언박싱],https://biz.heraldcorp.com/article/10803063?ref=naver,“드라이아이스 수급 문제로 ‘10분 거리’까지만 포장 가능합니다.” 올여름 드라이아이스 수급 불안이... 드라이아이스는 원유 정제 과정에서 발생하는 액화탄산을 원료로 한다. 올해 2월 중동 전쟁 발발 이후 국내 원유... ,12
원유,2026-07-10,이데일리,반도체주 급등에 S&P500·나스닥 상승…중동 충돌에도 AI 낙관론 우세[월...,https://www.edaily.co.kr/news/newspath.asp?newsid=01954886645513208,"최근 반도체주는 AI 투자 과열 우려와 공급 과잉 가능성, 막대한 투자에도 수익성이 충분히 검증되지... 미국 서부텍사스산원유(WTI)는 2.1% 하락한 배럴당 71.94달러를 기록했고, 브렌트유도 2.4% 내린 배럴당 76.12달러에... ",9
원유,2026-07-10,뉴스1,"러 '경유 수출금지'에 공급난 가중…""유럽-非유럽 물량경쟁 전망""",https://www.news1.kr/world/asia-australia/6224090,소비자들이 원유 가격 하락의 효과를 체감하지 못하고 있다. 우크라이나가 러시아 에너지 시설을 겨냥해 드론 공격을 이어 오면서 지난 5월 말부터 러시아의 연료 수급난이 본격화했다. 케이플러(Kpler) 정유·모델링 담당... ,8
원유,2026-07-10,비즈니스포스트,[Who Is ?] 김홍국 하림그룹 회장,https://www.businesspost.co.kr/BP?command=article_view&num=441021,치킨 해외 판매는 전년 대비 육계시장 하락에도 수급 안정화로 인한 생산성 개선과 판매량 상승(전년 대비... 팬오션이 한화오션으로부터 초대형 원유운반선(VLCC) 4척을 수주했다. 2026년 2월12일 한화오션은 모 아시아... ,8
중동영향,2026-07-10,조선비즈,이란 전쟁 장기화에… 트럼프-석유업계 갈등 커지나,https://biz.chosun.com/international/international_general/2026/07/10/7ONEVETVQZDAXHBZ5AW2EM77MU/?utm_source=naver&utm_medium=original&utm_campaign=biz,"美·이란 충돌로 고유가 유지될 듯 이란 전쟁으로 유가가 오르고 미국 대형 석유기업들이 사상 최고 수준의... 이는 전 분기보다 3배 이상 증가한 수치로, 원유와 디젤, 항공유 가격 상승에 따른 전시 특수의 영향으로... ",24
중동영향,2026-07-10,뉴시스,미·이란 재충돌에 호르무즈 해상운송 급감…하루 13척,https://www.newsis.com/view/NISX20260710_0003703882,호르무즈 해협은 걸프 산유국 원유와 액화천연가스(LNG)가 세계 시장으로 나가는 핵심 통로다. 전쟁 전에는 하루 100척이 넘는 선박이 이 해협을 통과했다. 그러나 미국과 이란의 군사 충돌 이후 통행량은 크게 줄었다.... ,25
중동영향,2026-07-10,에너지경제,“합의 끝났다”고 선언한 트럼프…美·이란 MOU ‘새판짜기’ 수순? [이...,https://www.ekn.kr/web/view.php?key=20260710022581210,"여기에 미국과 이란이 공격을 주고받고, 미국이 이란 원유 재제를 다시 부과하자 MOU를 통해 약속된 후속 종전 협상의 개최 여부는 더욱 불확실해졌다. 싱크탱크 전략국제문제연구소(CSIS)의 모나 야쿠비안 중동프로그램... ",23
중동영향,2026-07-09,아주경제,"이란 매체 ""미군 발사체, 부셰르 원전 주변부 타격""",https://www.ajunews.com/view/20260709203721579,"이란은 사흘 전 지정 항로를 벗어나 호르무즈 해협을 통과하려던 유조선 3척을 공격했고, 이후 미군은 이에 대한 대응 차원에서 이란 남부 지역의 군 시설과 북동부의 철도 교량 등을 공습했다. 이란도 쿠웨이트와 바레인... ",23
중동영향,2026-07-09,뉴스핌,"트럼프 ""이란 전쟁 재개 없을 것""…추가 공습 가능성은 열어둬",https://www.newspim.com/news/view/20260709001312,미국은 이란의 국제 원유 판매를 허용했던 제재 면제 조치도 철회했다. 미국과 이란이 휴전을 위한 양해각서에 서명한 지 3주여 만에 무력 충돌이 재개되면서 트럼프 대통령이 추진해 온 전쟁 출구 전략에도 차질이... ,23
중동영향,2026-07-09,중앙일보,"미 재공습에 이란 재반격, 연이틀 충돌…종전 MOU 유명무실",https://www.joongang.co.kr/article/25443771,미국이 전날 이란산 원유 제재를 복원하고 공습을 재개한 데 이어 해상 역봉쇄까지 되살릴 경우 양국 관계는 사실상 MOU 체결 이전 상태로 회귀하게 된다. 이란 “바레인·쿠웨이트 미군 시설 85곳 타격” 이란은 전날에... ,21
중동영향,2026-07-10,파이낸셜뉴스,美-이란 보복 공습 악순환…호르무즈 해협 통항 선박 '급감',http://www.fnnews.com/news/202607100727292900,미국과 이란이 9일(현지시간)에도 보복 공습을 주고받으며 군사적 긴장이 최고조로 치닫고 있다. 양국의 무력 충돌로 세계 주요 원유 수송로인 호르무즈 해협을 통과하는 선박 수가 극적으로 감소하는 등 글로벌 물류대란... ,19
