category,date,source,title,link,description,hits
나프타,2026-04-30,뉴시스,"정부, 비축유 스와프 최장 7월까지 연장…나프타 수급 이상無",https://www.newsis.com/view/NISX20260430_0003613013,나프타 및 기초유분 수급과 관련해선 대체 수입선이 다변화된 상황이고 석화 기업들의 공장 가동률도 높아지고 있는 만큼 석화제품 생산도 안정화될 것으로 전망했다. 정부는 추가경정예산안 편성을 통해 나프타... ,36
나프타,2026-05-01,연합뉴스,중동전쟁 파고 넘은 한국 수출…두달 연속 800억달러 돌파(종합),https://www.yna.co.kr/view/AKR20260501020452003?input=1195m,"그는 ""주요 품목 경쟁 심화, 중동 전쟁에 따른 원재료 수급 어려움 등 수출 변동성이 확대될 우려가 있다... 원유·나프타 등 대체 물량을 추가 확보함으로써 기업들이 글로벌 경쟁력을 지속 발휘할 수 있는... ",33
나프타,2026-04-30,뉴스1,"LG화학, 1Q 영업손실 497억…전분기 대비 적자 폭 크게 줄여(종합)",https://www.news1.kr/industry/general-industry/6154548,"하지만 나프타 래깅 효과 지속 및 비용 절감 활동 등을 통해 전 분기와 유사한 수준의 수익성을 예상했다. LG화학은 컨퍼런스 콜을 통해 ""중국에서 대규모 증설을 여전히 진행하는 부분이 있어 구조적인 공급 과잉은... ",29
나프타,2026-04-30,한국경제,"“돌고 돌아 미국”…중동산 나프타 수급 문제, 미국산으로 대체",https://magazine.hankyung.com/business/article/202604309376b,중동 전쟁 여파로 흔들린 나프타 수급이 5월부터 안정될 전망이다. 미국이 최대 수입국으로 부상하는 등 공급망이 빠르게 재편됐다. 이에 정부의 긴급 지원까지 더해지면서 공급 불안이 완화되고 있다. 나프타는... ,27
나프타,2026-04-30,뉴스핌,"LG화학, 1Q 영업손실 497억원...""석화 선방에도 배터리 부진""",https://www.newspim.com/news/view/20260430001039,"LG화학 CFO 차동석 사장은 ""원재료 수급 불안에 따른 불확실성 속에서도 석유화학부문의 원료 가격 상승에... 2분기는 NCC 2공장 일시적 가동중단에 따른 판매 물량 감소가 불가피하나, 나프타 래깅 효과 지속 및 비용... ",19
나프타,2026-04-30,연합뉴스,"LG화학, 자회사 부진에 1분기 적자…""석화 재편 연내 최종승인""(종합2보...",https://www.yna.co.kr/view/AKR20260430113302527?input=1195m,"지난달 23일 나프타(납사) 수급 차질로 중단된 여수 나프타분해시설(NCC) 2공장과 관해서는 ""3월 크래커 평균 가동률은 60% 수준""이라며 ""2분기에도 가동 중지는 이어지겠지만 대산과 여수 1공장의 평균 크래커 가동률을... ",16
나프타,2026-04-30,아주경제,"LG화학, 1분기 석화 부활 속 양극재 부진 해소 과제...NCC 가동률 75%로 ...",https://www.ajunews.com/view/20260430171431196,"석화부문 2월 흑자전환...나프타 가격상승 재고 래깅 효과도 2분기에도 석화 흑자 이어질 전망, NCC 통합은... 차동석 LG화학 최고재무책임자(사장)는 ""원재료 수급 불안에 따른 불확실성 속에서도 석화 부문의 원료 가격... ",15
원유,2026-05-01,연합뉴스,중동전쟁 파고 넘은 한국 수출…두달 연속 800억달러 돌파(종합),https://www.yna.co.kr/view/AKR20260501020452003?input=1195m,"수급 어려움 등 수출 변동성이 확대될 우려가 있다""며 ""정부는 마케팅·금융·보험 지원과 수출 시장 다변화 정책 등을 통해 수출 기업의 부담을 최소화하는 한편, 적극적으로 통상 네트워크를 활용해 원유... ",45
원유,2026-04-30,이데일리,"트럼프 “UAE OPEC 탈퇴, 유가 낮출 것”…현실은 4년 만에 최고치",http://www.edaily.co.kr/news/newspath.asp?newsid=03840886645421368,"이란은 미국이 역봉쇄를 해제하기 전까지 호르무즈 해협을 재개방하지 않겠다는 입장을 유지하고 있어, 글로벌 원유 수급 불확실성은 당분간 지속될 전망이다. 전문가들은 UAE의 갑작스러운 OPEC 탈퇴 결정이 시장에... ",34
원유,2026-04-30,뉴시스,"정부, 비축유 스와프 최장 7월까지 연장…나프타 수급 이상無",https://www.newsis.com/view/NISX20260430_0003613013,기업들이 원유 수급에 어려움을 겪고 있지 않는 상황이기 때문에 도입선 다변화 등을 통한 비축유 스와프를 최대한 활용하고 비축유 방출의 경우 최후의 보루로 남겨두는 방식을 택할 수 있다는 여지를 둔 것으로... ,28
원유,2026-05-01,머니투데이,반도체 수출 2개월 연속 300억불 돌파…4월 전체 수출 858억불,https://www.mt.co.kr/economy/2026/05/01/2026050109140777208,"수급 어려움 등 수출 변동성이 확대될 우려가 있다""며 ""정부는 마켓팅·금융·보험 지원과 수출 시장 다변화 정책 등을 통해 수출 기업의 부담을 최소화하는 한편, 적극적으로 통상 네트워크를 활용하여 원유... ",20
원유,2026-05-01,뉴시스,중동 여파에도 '반도체 슈퍼사이클'…사상 첫 2月 연속 800억불↑(종합2...,https://www.newsis.com/view/NISX20260501_0003614347,"원재료 수급 어려움 등 수출 변동성이 확대될 우려가 있다""며 ""정부는 마켓팅·금융·보험 지원과 수출 시장 다변화 정책 등을 통해 수출 기업의 부담을 최소화하고 원유·나프타 등 대체 물량을 추가... ",21
원유,2026-04-30,매일경제,공급혼란 장기화 우려…브렌트유 4년 만에 최고,https://www.mk.co.kr/article/12032315,미국과 이란 간 종전 협상이 교착 상태에 빠지며 에너지 공급 혼란이 예상보다 장기화할 것이란 우려가... 같은시간 뉴욕상품거래소에서 거래된 6월 인도분 서부텍사스산원유(WTI) 선물도 전 거래일 대비 2.7% 오른... ,18
원유,2026-04-30,이데일리,생산·소비·투자 '트리플 증가'…전쟁 여파 '폭풍전야'(종합),http://www.edaily.co.kr/news/newspath.asp?newsid=04490326645421368,"데이터처는 원유 수급 문제가 있는 분야를 중심으로 이미 일부 영향이 감지되고 있다고 설명했다. 실제 지난달 석유정제와 화학제품 생산은 각각 전월 대비 6.3%, 0.3% 줄었으며, 가동률(출하) 역시 각각 5.4%, 0.1... ",16
중동영향,2026-04-30,헤럴드경제,"내달 원유 7000만배럴 도입, 평시의 87.5%…비축유 스와프 7월까지 연장",https://biz.heraldcorp.com/article/10729158?ref=naver,(5000만배럴) 원유수급이 가능했다”고 덧붙였다. 그러면서 “비축유 스와프가 2개월 단위인데 6~7월도 할 것 같다”면서 “기업 수요가 있고 필요시 계속 연장할 듯 싶다”고 말했다. 이란의 호르무즈 해협 통행료 부과... ,29
중동영향,2026-05-01,파이낸셜뉴스,"트럼프, 이탈리아·스페인서도 미군 감축 고려 질문에 ""아마도""(종합)",http://www.fnnews.com/news/202605010805454150,"트럼프 대통령은 러시아와 우크라이나 간 전쟁에서 미국이 유럽과 함께 우크라이나 문제를 도왔지만, 이란... 아울러 미국-캐나다 국경에서 와이오밍주까지 원유를 수송하는 파이프라인 건설 사업도 승인했다.",24
중동영향,2026-05-01,동아일보,"美, ‘호르무즈 연합체’ 추진… 각국에 참여 요청",https://www.donga.com/news/Inter/article/all/20260501/133845392/2,도널드 트럼프 미국 행정부가 미국·이스라엘과 이란 전쟁 발발 뒤 이란과 미국이 동시에 봉쇄 중인 원유 수송로 호르무즈 해협의 원활한 항행을 위해 국제 연합체 ‘해양 자유 연합(Maritime Freedom Construct·MFC)’ 결성을... ,20
중동영향,2026-05-01,경향신문,중동 사태에도 두 달 연속 수출액 800억달러 돌파…반도체가 살렸다,https://www.khan.co.kr/article/202605011433001,이란의 호르무즈 해협 봉쇄로 인한 국제유가 급등에 석유제품 수출액도 늘었다. 석유제품 수출액은 39.9... 특히 원유 수입액은 국제유가 급등 영향으로 13.1% 증가한 70억달러를 기록했다. 반도체 장비... ,19
중동영향,2026-05-01,동아일보,"트럼프 “봉쇄가 폭격보다 효과적… 이란, 돼지처럼 질식할것”",https://www.donga.com/news/Inter/article/all/20260501/133845390/2,미국의 해상 봉쇄로 이란의 원유 수출이 막혀 석유 저장시설이 포화되는 등 위기를 겪고 있다고 주장한 것이다. 양측의 대치가 이어지면서 미국의 해상 봉쇄가 장기화될 거라고 액시오스는 전망했다. 또 월스트리트저널... ,15
중동영향,2026-05-01,연합뉴스,중동전쟁 파고 넘은 한국 수출…두달 연속 800억달러 돌파(종합),https://www.yna.co.kr/view/AKR20260501020452003?input=1195m,"증가했으나 중동 수출은 물류 차질 등 영향으로 25.1% 감소한 12억7천만달러로 줄어들었다. 수입에서는 에너지 수입이 106억1천만달러로 7.5% 증가했고, 에너지 외 수입(515억1천만달러)은 18.8% 늘어났다. 이중 원유... ",13
중동영향,2026-05-01,파이낸셜뉴스,"독일 다음은 이탈리아·스페인…트럼프, 유럽 미군 재배치 시사",http://www.fnnews.com/news/202605010527152624,북대서양조약기구(NATO·나토) 동맹국들이 호르무즈 해협 군사 지원 요청에 소극적으로 대응한 데 대한... 이번 발언의 배경에는 호르무즈 해협 갈등이 자리 잡고 있다는 분석이 나온다. 트럼프 대통령은 이란이 봉쇄한... ,13
