category,date,source,title,link,description,hits
나프타,2026-06-12,뉴스1,"중동전쟁 장기화에 식품업계 비상…식산협 ""세제·수출 지원 확대 필요...",https://www.news1.kr/industry/distribution/6195798,"포장재 원료인 나프타 공급은 회복세를 보이고 있지만 가격은 여전히 높은 수준이며, 해상운임 상승과 환율... 이에 농식품부는 원재료·포장재 수급 상황을 지속 점검하는 한편 수출 확대와 산업 경쟁력 강화를 위한... ",16
나프타,2026-06-12,서울경제,"한신평 “여천NCC, 실적 부진 장기화…신용등급 BBB+로 하향” [시그널]",https://www.sedaily.com/article/20055156?ref=naver,"전쟁 이전 낮은 가격으로 확보한 나프타 투입, 공급 축소에 따른 판매단가 강세, 정부의 원가 보조 정책 등에 힘입어 일시적으로 영업 흑자를 기록할 수도 있다는 전망이다. 다만 5월 이후 주요 석유화학 제품... ",8
나프타,2026-06-12,이데일리,"대우건설, 나이지리아 인도라마 비료 플랜트 3호기 준공",https://www.edaily.co.kr/news/newspath.asp?newsid=04995446645481064,대우건설이 시공한 인도라마 비료 플랜트 3호기 현장 전경 이번 사업은 글로벌 석유화학 그룹... 해당 플랜트는 천연가스를 원료로 암모니아를 생산한 뒤 이산화탄소와 반응시켜 요소를 생산하는 시설이다.... ,8
나프타,2026-06-13,매일경제,이재용 “삼성에 특별한 국가…이탈리아와 다양한 협력 확대 가능”,https://www.mk.co.kr/article/12073328,김동춘 LG화학 대표는 “글로벌 공급망이 불확실한 시기에 기존 석유화학 기반 원료를 대체할 수 있는 대체 원료 확보가 매우 중요하다”며 “이탈리아의 에너지 기업인 에니(Eni) 그룹과의 합작을 통해 바이오 나프타... ,6
나프타,2026-06-12,머니투데이,중동 리스크에 농자재 가격 압박…국제 가격 상승분 시차 반영 우려,https://www.mt.co.kr/economy/2026/06/12/2026061210591715006,한국농촌경제연구원(KREI)은 최근 발간한 '국제 원자재 가격 상승에 따른 국내 농자재 수급 영향과 시사점... 3월 원유 수입물가지수는 전월 대비 88.5% 급등했고 나프타 수입물가지수 역시 69.6% 상승했다. 특히 나프타는... ,6
나프타,2026-06-12,이데일리,중동 긴장 완화에 유가 하락…산업계 변수 확대,https://www.edaily.co.kr/news/newspath.asp?newsid=03863846645481064,"이번 중동 사태는 원유 공급 감소로 인해 발생했기 때문에, 원유에서 추출되는 석화산업의 핵심 원료 나프타의 공급부족과 가격 급등 현상이 동시에 발생했다. 그동안 중국발(發) 공급과잉으로 몇 년째 침체 국면에서... ",4
나프타,2026-06-13,뉴시스,강달러에 원가 폭등…식품·패션업계 수익성 '비상'[고환율이 바꾼 소비...,https://www.newsis.com/view/NISX20260612_0003667430,"상황""이라며 ""수급 조절을 하고 있지만, 국제 원재료 가격이 오른 상황에서 체감상 고환율이 수개월째... 대표 소재인 폴리에스터, 나일론, 아크릴 등 3대 합성섬유의 원료는 나프타다. 산업통상부에 따르면 나프타... ",5
원유,2026-06-12,한국경제,"트럼프 ""이란 공습 취소""에 국제 유가 2.92% 급락",https://magazine.hankyung.com/business/article/202606122370b,이에 따라 시장에서는 중동 지역 원유 공급 차질 가능성이 부각되며 국제유가가 상승세를 이어왔다. 트럼프 대통령이 예정된 군사행동을 취소하면서 시장에서는 최악의 시나리오를 피했다는 안도감이 확산됐다.... ,39
원유,2026-06-12,한국경제,지난 1세기 석유가 뒤흔든 국제 질서⑦-마지막회· [홍영식의 이슈 워치...,https://magazine.hankyung.com/business/article/202606107572b,러시아는 당시 세계 석유의 약 10%를 공급하고 있었다. 배럴당 60달러가 넘는 러시아산 원유는 구매할 수 없도록 했다. 60달러를 넘을 경우 해상 보험과 수출입 금융 등을 하지 못하게 했다. 가격상한제는 우크라이나 전쟁... ,10
원유,2026-06-12,이데일리,"뉴욕증시, 이란 핵합의 기대에 급반등…나스닥 2.5%↑[월스트리트in]",https://www.edaily.co.kr/news/newspath.asp?newsid=01968006645481064,이란 원유 수출 대금 해제 방식 등 세부 사항에 대한 협상이 남아 있다고 전했다. 복수의 이란 및 서방... 노동부는 최종수요 재화 가격 상승분의 약 80%가 에너지 가격 상승 때문이라고 설명했다. 실제로 에너지 가격은... ,9
원유,2026-06-13,경향신문,전국 휘발유 가격 평균 2009원대…4주 연속 하락,https://www.khan.co.kr/article/202606131352001,"수입 원유 가격 기준인 두바이유는 지난주보다 4.5달러 내린 89.7달러였다. 국제 휘발유 가격은 1.3달러 오른 117.5달러, 국제 자동차용 경유는 7.9달러 내린 140.1달러로 집계됐다. 한편 정부는 지난달 22일부터... ",9
원유,2026-06-12,아주경제,"남양유업 ""1분기 푸드서비스 사업 13% 성장…카페·단체급식·군납 채널...",https://www.ajunews.com/view/20260612100721763,"[사진=남양유업] 남양유업의 푸드서비스(FS) 사업 부문이 단순 원유 납품에서 벗어나 파트너사의 메뉴 개발... 또 판매량 증가에 대비해 부자재 수급과 생산 계획을 사전에 조율하고, 국내 생산 여건이 불안정한 품목은... ",9
원유,2026-06-12,조선일보,미국은 공급 늘리고 중국은 수요 줄이고…유가가 더 폭등 않는 이유,https://www.chosun.com/economy/economy_general/2026/06/12/2OMK7BHP25GMBDGDS5XV53YAKQ/?utm_source=naver&utm_medium=referral&utm_campaign=naver-news,호르무즈 해협이 오랫동안 봉쇄되면 하루 1000만 배럴의 원유 공급이 감소할 것으로 전망했기 때문이다. 하지만 중동전쟁 3개월이 지나 호르무즈 해협 봉쇄가 장기화되고 있지만 WTI(서부텍사스유) 가격은 현재 배럴당... ,7
원유,2026-06-12,파이낸셜뉴스,원유 수출 1위 오른 美...달러 패권 넘어 에너지 패권,http://www.fnnews.com/news/202606120106401522,실제로 미국은 유럽 최대 원유 공급국으로 자리 잡았다. 우크라이나 전쟁 이후 러시아산 에너지 의존도를 낮추려는 유럽의 움직임 속에 미국산 원유 수입 비중은 크게 확대됐다. 올해 들어 미국 원유 수출의 약 47%가... ,7
중동영향,2026-06-13,연합뉴스,미·이란 '종전 MOU' 임박했다지만…호르무즈·핵·제재 '동상이몽',https://www.yna.co.kr/view/AKR20260613019600009?input=1195m,"이란이 약속한 의무를 실제로 이행하고 국제적 검증을 통과해야만 동결자금 지급과 원유 제재 해제 등 경제적 보상이 뒤따른다는 것이다. JD 밴스 미국 부통령도 이와 관련해 ""그저 합의에 서명하거나 회의에 참석한다고... ",100
중동영향,2026-06-13,파이낸셜뉴스,미·이란 종전 MOU 서명 임박… 완전 타결 가로막는 '미완성 불씨'는?,http://www.fnnews.com/news/202606130924491064,이란과 오만이 주권을 가진 호르무즈 해협을 통과하는 글로벌 선박들에 대해 향후 '서비스 수수료'를 부과하겠다는 방침을 고수한 것이다. 전 세계 해양 원유 수송량의 5분의 1이 지나는 길목을 쥐고 언제든 대미 압박... ,41
중동영향,2026-06-13,헤럴드경제,이란 ‘무기한’ 핵 포기 받아드나…美 “종전 MOU 따르면 경제적 보상...,https://biz.heraldcorp.com/article/10770910?ref=naver,이어 “그들이 약속을 지킨다면 우리도 분명히 약속을 지킬 것”이라며 이란에 대한 경제적 혜택은 해외의 동결된 자금을 지급하고 원유 판매 등 제재를 해제하는 조치가 포함된다고 밝혔다. MOU에는 서명 즉시... ,36
중동영향,2026-06-13,매일경제,종전 기대에 스페이스X 흥행까지…뉴욕증시 동반 상승,https://www.mk.co.kr/article/12073296,미국과 이란의 종전 합의 기대감이 커진 가운데 스페이스X가 성공적인 증시 데뷔를 치르면서... 서부텍사스산원유(WTI) 7월물도 3.23% 내린 84.88달러에 거래를 마쳤다. 이날 최대 화제는 단연 스페이스X였다. 역대... ,28
중동영향,2026-06-13,중앙일보,"트럼프, 이란과 종전 합의문 주말 서명 가능성",https://www.joongang.co.kr/article/25436428,트럼프 대통령은 당초 이날 오전까지만 해도 트루스소셜을 통해 “머지않은 시일 내 카르그섬(이란 원유 수출 등 물류 핵심 거점)과 기타 석유 인프라 거점을 점령하고 이란의 석유·가스 시장을 완전히 장악할 것”... ,24
중동영향,2026-06-12,뉴스핌,"[종합] 트럼프 ""이란 최고지도부, 합의안 승인"" 공습 전격 취소",https://www.newspim.com/news/view/20260612000018,"그는 또 협상에는 미국뿐 아니라 이스라엘, 사우디아라비아, 아랍에미리트(UAE), 카타르, 터키, 파키스탄... 카르그섬은 이란 남부 해안에서 불과 16마일(25.7킬로미터) 떨어진, 이란 원유 수출의 90%가 통과하는 핵심... ",21
중동영향,2026-06-13,이데일리,미 고위당국자 “미·이란 합의 수일 내 서명 가능성…성사 확률 80~85%”,https://www.edaily.co.kr/news/newspath.asp?newsid=01646566645481392,"앞서 이란 메흐르 통신은 미국의 대이란 원유 제재 해제, 해상 봉쇄 종료, 동결 자금 반환 등을 포함한 14개 조항의 합의 초안을 보도했다. 그러나 트럼프 대통령은 이날 자신의 소셜미디어 트루스소셜에 “언론에 보도된... ",13
