category,date,source,title,link,description,hits
나프타,2026-07-20,아시아경제,"산업부, 직원 특별포상…석유 가격 안정화 등 45명에 9100만원",https://view.asiae.co.kr/article/2026072016291994492,에너지 수급 안정 대책을 추진했다. 또 호르무즈 해협 봉쇄 가능성에 대비해 대체 공급망을 확보하고 나프타와 요소 등 필수 원자재 수입 비용을 지원해 국내 산업계의 생산 차질을 최소화한 점도 높은 평가를 받았다.... ,15
나프타,2026-07-20,아주경제,"홍해·호르무즈 쌍방 봉쇄 위기에 정유·석화업계 '비상'...""수익 악화 불...",https://www.ajunews.com/view/20260720153431036,"9월 원유 물량까지 확보...""당장 수급 차질 없어"" 기업들 유가·운임·보험료 동반 상승 부담 커져 국제 유가... 공급 불안정성으로 인한 원유 가격 상승이 나프타 가격 인상으로 이어져 원료비 부담을 키우기 때문이다.... ",8
나프타,2026-07-21,머니투데이,"'저가 공세' 중국 보고 있나...AI 올라탄 'K철강', 수출액 들썩",https://www.mt.co.kr/industry/2026/07/21/2026072017021134956,국내에서 유일하게 판재류부터 봉형강까지 전력 인프라에 들어가는 전 제품을 공급할 수 있다는 강점을... 석유화학업계는 총 270만~370만톤 규모의 NCC(나프타분해설비) 생산 감축을 추진하고 있다. 철강업계에는... ,4
나프타,2026-07-20,머니투데이,"오뚜기, 카레 원료 '강황' 국산화 실험",https://www.mt.co.kr/industry/2026/07/20/2026071919372733394,이후 재배범위를 강황 등 주요 향신료로 확대해 제품에 적용하기 위한 품질과 수급 타당성 등을 테스트할... 국제유가와 나프타 가격변동으로 포장재 가격이 상승한 데다 고환율로 주요 원재료의 수입 비용이 증가해... ,4
나프타,2026-07-21,경향신문,다시 격화하는 두 개의 전쟁…‘생계형 연료’ 경유 가격 위험하다,https://www.khan.co.kr/article/202607210600031,"산업부는 이날 정부세종청사에서 석유 최고가격제 운용과 비축유 스와프 제도 신설, 원유 수입처 다변화 지원 등으로 원유·나프타 수급 안정에 이바지한 공로를 인정해 김종철 자원산업정책관 등 25명에게 포상금을... ",5
나프타,2026-07-20,경향신문,"아프리카 직항길 넓어진다…한국-알제리, 주 4회 운수권 합의",https://www.khan.co.kr/article/202607201754011,"특히 알제리는 한국의 중요한 나프타 공급국으로 꼽힌다. 한국은 아랍에미리트에 이어 알제리에서 두 번째로 많은 나프타를 수입하고 있으며, 이는 나프타 전체 수입량의 약 11%에 달한다. 알제리의 수출 규제로 인해... ",5
나프타,2026-07-20,서울경제,납사 지고 중국산 올레핀 떴다…울산항 석유화학 수입지도 ‘격변’,https://www.sedaily.com/article/20069504?ref=naver,"석유화학의 핵심 기초원료인 납사(Naphtha) 수입이 크게 줄어든 반면, 중국산 에틸렌과 프로필렌 등 올레핀 계열 제품의 수입이 폭발적으로 증가했다. 국내 기업들이 납사를 수입해 국내에서 에틸렌을 직접... ",3
원유,2026-07-21,헤럴드경제,"‘親이란’ 후티, 사우디 해상 봉쇄 선언…“한·일 등 아시아 수입국 ...",https://biz.heraldcorp.com/article/10814205?ref=naver,호르무즈 해협의 통항이 사실상 중단된 상황에서 ‘우회로’로 여겨온 홍해 입구 바브엘만데브 해협까지 봉쇄될 경우 원유와 석유제품의 글로벌 공급망에 큰 충격이 불가피하다는 우려가 커지고 있다. 특히 중동산 원유... ,30
원유,2026-07-21,헤럴드경제,7월 1~20일 수출 52% 증가…반도체 180.6%↑,https://biz.heraldcorp.com/article/10814581?ref=naver,"메모리 고정가격 상승과 인공지능(AI) 서버용 고대역폭메모리(HBM), SSD 수요 확대가 수출 증가를... 반도체(54.9%), 반도체 제조장비(56.9%), 원유(27.5%), 가스(27.9%) 등의 수입이 늘었으며, 에너지 수입액은 27.4... ",26
원유,2026-07-20,뉴시스,미·이란 충돌에 유가 3%↑…브렌트유 다시 90달러,https://www.newsis.com/view/NISX20260720_0003714790,"이번 충돌은 에너지 시장의 공급 여건이 이미 악화된 상황에서 발생했다. 원유 재고는 미국과 이스라엘이 2월 말 이란 공습을 시작했을 당시보다 감소한 상태이며, 우크라이나의 공격으로 러시아 정유시설도 큰 피해를... ",23
원유,2026-07-21,동아일보,반도체 호조 이어지며 이달 1~20일 수출액 549억 달러…또 역대 최대,https://www.donga.com/news/Economy/article/all/20260721/134334685/1,"인공지능(AI) 서버용 솔리드스테이트드라이브(SSD) 수요가 확대되면서 컴퓨터 주변기기 수출은 231.9... 반도체 제조 장비와 반도체 수입이 각각 56.9%, 54.9% 증가했고 원유·가스·석탄 등 에너지 수입액도 27.4... ",21
원유,2026-07-21,서울경제TV,미·이란 군사 충돌 격화에 국제유가 상승세…브렌트유 1.3%↑,https://www.sentv.co.kr/article/view/sentv202607210015,"미국과 이란 간 군사적 충돌이 격화되면서 원유 공급망 차질 우려로 국제유가가 한 달여 만에 최고치를 기록했다. 핵심 원유 수송로인 호르무즈 해협과 홍해 관문이 위협받는 가운데, 시장에서는 유가가 배럴당... ",18
원유,2026-07-21,이투데이,'반도체의 힘' 7월 중순 수출 역대 최고⋯'美관세·홍해 리스크' 복병 [...,https://www.etoday.co.kr/news/view/2605572,"에너지 수급 불안 우려가 고조되고 있기 때문이다. 이달 1~20일 수입액은 전년 대비 20.0% 증가한... 에너지원의 경우 가스(27.9%), 원유(27.5%), 석탄(25.7%) 수입이 일제히 늘어 전체 에너지 수입액은 27.4% 증가했다.... ",16
원유,2026-07-21,디지털타임스,호르무즈 격랑에 석유 정제마진 급등…미·유럽 사상 최고 수준,https://www.dt.co.kr/article/12073866?ref=naver,"러시아는 우크라이나의 잇단 드론 공격으로 정유시설이 타격을 입어 경유 수출을 제한했고, 아시아 정유사들도 원유 공급 제약으로 가동을 줄였다. 국제에너지기구(IEA)는 2분기 전 세계 정제유 생산량이 전년 대비... ",10
중동영향,2026-07-21,한겨레,"후티 반군, 사우디 ‘해상 봉쇄’ 선언…홍해 원유 수송 비상",https://www.hani.co.kr/arti/international/international_general/1269200.html,바브엘만데브해협은 전 세계 해상 원유 수송량의 약 10~12%가 통과하는 요충지다. 특히 이란의 페르시아만 봉쇄로 호르무즈해협이 막힌 상황에서 사우디는 홍해와 맞닿은 서부의 얀부항구를 통해 원유를 우회 수송하며... ,122
중동영향,2026-07-21,중앙일보,정부 “9월까지 원유 90% 이상 확보…홍해 봉쇄돼도 수급 문제 없어”,https://www.joongang.co.kr/article/25446762,"정부가 미국과 이란의 갈등으로 중동 공급망 불안이 커지는 상황에서도 9월까지 국내 원유 수급에는 큰 문제가 없을 것이라고 밝혔다. 산업통상자원부는 21일 “7~8월 도입 원유는 지난해 평균 대비 110% 이상 확보했고, 9월... ",77
중동영향,2026-07-21,동아일보,이란 “호르무즈 유조선 2척 폭발”… 충돌 격화,https://www.donga.com/news/Inter/article/all/20260721/134332737/2,"이란도 바레인, 쿠웨이트, 요르단 등 친미 중동 국가를 공격했고, 자신들이 봉쇄 중인 원유 수송로 호르무즈 해협을 통과하려던 민간 유조선 2척이 폭발했다고 주장했다. 워싱턴포스트(WP)는 양측의 행보가 “전면전에... ",39
중동영향,2026-07-21,이데일리,호르무즈 이어 홍해 봉쇄까지…에너지 공급망 위협 확대,https://www.edaily.co.kr/news/newspath.asp?newsid=03716246645516816,미국과 이란의 무력 충돌로 호르무즈 해협이 다시 위기에 놓인 가운데 친이란 예멘 후티 반군이 사우디아라비아에 대한 해상 봉쇄를 선언하면서 중동의 양대 원유 수송로가 동시에 위협받고 있다. 후티 반군의 봉쇄... ,34
중동영향,2026-07-21,이데일리,"트럼프 ""이란, 미군 사망 대가 치를 것""…휴전 중재에도 중동 확전 우려",https://www.edaily.co.kr/news/newspath.asp?newsid=01443206645516816,이에 따라 홍해를 통한 사우디 원유 수출에도 차질이 발생할 수 있다는 우려가 커지고 있다. 미국은... 이스라엘도 대이란 대응 수위를 높이고 있다. 엘리 코헨 이스라엘 안보내각 장관은 이날 “이란이 이스라엘을... ,21
중동영향,2026-07-21,헤럴드경제,‘호르무즈 우회로’ 홍해까지 살얼음판…韓 등 亞수입국 ‘직격탄’ [...,https://biz.heraldcorp.com/article/10814828?ref=naver,"뉴욕타임스(NYT)에 따르면 이곳은 세계 원유 운송의 3% 이상이 통과하는데, 최근에는 사우디가 이란이 봉쇄한 호르무즈 해협을 피하기 위해 이곳을 통한 원유 수출을 늘리면서 그 비중이 7%까지 늘었다. 전쟁 전... ",22
중동영향,2026-07-21,조선비즈,"美·이란 전면전에 휴전 논의 나선 중재국... 카타르, 10일 휴전 제안",https://biz.chosun.com/international/international_general/2026/07/21/3D7SEAH5PZHSXJIPC2AXS56QD4/?utm_source=naver&utm_medium=original&utm_campaign=biz,이란이 호르무즈해협을 봉쇄한 상황에서 사우디가 원유를 수출할 수 있는 핵심 우회로이기도 하다. 후티가 홍해 항로를 위협하면 호르무즈해협 봉쇄를 최후의 압박 수단으로 활용하는 이란의 지정학적 영향력은 더욱... ,20
