category,date,source,title,link,description,hits
나프타,2026-07-03,서울경제TV,"한화토탈에너지스, 고객사 제품 납품 톤당 최대 20만원 인하",https://www.sentv.co.kr/article/view/sentv202607030090,앞서 정부는 석유화학 업계 지원을 위해 나프타 수급 안정화 지원사업을 시작했다. 이 사업에 따라 올해 4월부터 6월까지 석유화합 업계에 나프타 상승분 일부를 지원한다. 한화토탈에너지스는 이 지원을 산업 현장으로... ,31
나프타,2026-07-03,매일경제,"드디어 종전, 한국 기업 훈풍?",https://www.mk.co.kr/article/12084032,"중국 역시 호르무즈 해협 봉쇄로 중동산 원유, 나프타 수입이 막혀 곤란했는데, 전쟁이 끝나 수급이 정상화돼 다시 생산량을 확대할 가능성이 커졌기 때문이다. 게다가 중국뿐 아니라 사우디아라비아, 카타르, 쿠웨이트... ",8
나프타,2026-07-03,파이낸셜뉴스,"한화토탈, 주요 수지 제품 가격 인하..중소 고객사 부담 완화",http://www.fnnews.com/news/202607030932210179,"회사 측은 정부의 '나프타 수급 안정화 정책'을 통해 전쟁 여파로 증가한 원료 구매 비용의 일부를 지원받은 만큼, 지원 효과를 산업 현장과 소비자에게 환원한다는 취지에서 가격 인하를 결정했다고 설명했다. 인하된... ",6
나프타,2026-07-03,헤럴드경제,강경성 사장 “세계 수출 5강...소비재 비중 20%까지 키워야”,https://biz.heraldcorp.com/article/10797231?ref=naver,"아울러 강 사장은 “지난해 중동 분쟁으로 나프타 공급 차질이 발생했을 당시 해외 무역관을 활용해 총 29건, 87만톤 규모의 나프타를 확보하는 데 이바지했다”며 “공급망 안정화를 통해 한국 산업을 뒷받침하고, 해외... ",7
나프타,2026-07-03,아시아경제,중동발 나프타 쇼크에 다시 뜬 제지업,https://view.asiae.co.kr/article/2026070219082108778,나프타 수급 불안으로 플라스틱 대체재인 종이 포장재의 가치가 재조명되면서 제지업체들도 친환경 사업으로 무게중심을 옮기며 적극적으로 사업 확장에 나서는 모습이다. 3일 업계에 따르면 글로벌세아그룹은 최근... ,5
나프타,2026-07-03,서울경제,"“‘제재 유예’ 이란, 日에 석유 판매 검토 중”",https://www.sedaily.com/article/20063703?ref=naver,공익재단법인 니폰닷컴에 따르면 일본의 원유 수입량은 4월 이후 전년 대비 60%나 급감했으며 원유를 정제해 만드는 나프타 부족으로 식품 기업 칼비(Calbee)가 일부 제품의 포장 패키지를 흑백으로 바꾸는 등 어려움을... ,3
나프타,2026-07-03,머니투데이,"한화토탈에너지스, PE·PP 가격 인하…""내수 공급 안정화 위해""",https://www.mt.co.kr/industry/2026/07/03/2026070313095532978,한화토탈에너지스는 정부의 '나프타 수급 안정화 정책'을 통해 전쟁으로 상승한 원료 구매 비용의 일부를 지원받은 바 있다. 해당 지원 효과가 실제 산업 현장과 국민 생활까지 이어질 수 있도록 정책 취지에 맞췄다는... ,3
원유,2026-07-04,서울경제,"日, 이란산 원유 수입 재개 검토…“기업 3곳과 초기 협의”",https://www.sedaily.com/article/20063757?ref=naver,무역업계에서는 미국의 제재 유예 기간이 60일에 불과한 데다 아시아 정유사들의 원유 재고도 비교적 충분한 상황이어서 단기간 내 신규 계약이 성사되기는 쉽지 않을 것으로 보고 있다. 이란 측 역시 일본으로 원유를... ,14
원유,2026-07-04,서울경제,우크라 드론 공습에 러시아 연료난…“주유소 앞 5㎞ 대기줄”,https://www.sedaily.com/article/20063763?ref=naver,러시아 정부는 연료 수급 안정을 위해 품질 규제를 완화하고 휘발유와 항공유 수출을 중단한 상태다. 세계 2위 원유 수출국인 러시아가 부족한 휘발유를 인도 등에서 수입하는 처지가 됐다고 텔레그래프는 전했다.... ,10
원유,2026-07-03,매일경제,"드디어 종전, 한국 기업 훈풍?",https://www.mk.co.kr/article/12084032,"원유 공급이 정상화되면 원료 수급 불확실성이 해소되고 정제마진도 안정될 가능성이 높다. (3) 방산 업계, 종전 반긴다? 종전에도 국방력 재정비 수요 넘쳐나 이번 종전으로 방산 업체들도 내심 거는 기대가 크다. 얼핏... ",9
원유,2026-07-04,디지털타임스,"‘큰 손’ 日, 이란 원유수입 재개?…“업체 3곳 초기 협의 시작”",https://www.dt.co.kr/article/12071042?ref=naver,앞서 미국 재무부는 양국의 종전 회담이 진행되던 지난달 22일 이란산 원유의 생산·인도·판매를 일시적으로 허용하는 60일 한시의 임시 일반면허를 발급했다. 이에 이란은 오는 8월 21일까지 자국 원유를 판매하고 대금을... ,10
원유,2026-07-04,연합뉴스,"세계 식량가격, 2개월 연속 하락세…유지류·육류는 상승",https://www.yna.co.kr/view/AKR20260704028200030?input=1195m,"유럽연합(EU)과 미국의 원유 공급 여건 개선으로 탈지분유와 버터·치즈 가격이 내리고, 중국의 수입 수요... 농식품부 관계자는 ""국제 원자재 가격 등 대외 불확실성이 이어지는 만큼 품목별 수급 상황에 대한... ",8
원유,2026-07-04,이데일리,"이란, 美 제재 ‘60일 한시 면제’에 원유 수출 시동…日 바이어와 초기...",https://www.edaily.co.kr/news/newspath.asp?newsid=01433366645511240,"앞서 미국 재무부는 양국 종전 회담이 진행되던 지난달 22일 이란산 원유의 생산과 인도, 판매를 허용하는 60일짜리 임시 일반면허를 발급했다. 이에 따라 이란은 오는 8월 21일까지 자국산 원유를 수출하고 그 대금을... ",8
원유,2026-07-04,동아일보,"3년 8개월 내 최고 금리, 당신의 지갑 겨누고 있다",https://shindonga.donga.com/3/all/13/6286534/1,이란은 세계 원유 수송량의 20%가 지나는 호르무즈해협 봉쇄로 맞섰고 국제 유가는 90달러를 넘나들며... 먼저 중동전쟁이라는 공급발 인플레이션 변수를 제외하더라도 이미 전쟁 전에도 주요국 물가가 중앙은행의... ,5
중동영향,2026-07-03,이데일리,美 동결 자산 해제 당근에도 호르무즈 쥔 이란 '시큰둥',https://www.edaily.co.kr/news/newspath.asp?newsid=02669926645510912,지난달 미국은 이란과 종전 양해각서(MOU)를 체결하며 이란 해상 봉쇄를 해제하고 이란산 원유 제재를 한시적으로 완화했다. 카타르에 동결된 60억달러도 우선 해제하기로 했지만 이란이 호르무즈 해협 통행료 부과... ,24
중동영향,2026-07-04,뉴시스,"이란, 일본에 원유 다시 판다…제재 면제 연장 관건",https://www.newsis.com/view/NISX20260703_0003695661,"이후 일본과 한국, 인도, 유럽 국가들은 이란산 원유 수입을 중단했으며, 최근 수년간에는 중국이 사실상 이란산 원유의 최대 수입국 역할을 해왔다. 시장에서는 이번 제재 면제가 연장될 경우 일본뿐 아니라 한국과 인도... ",24
중동영향,2026-07-03,파이낸셜뉴스,"남재헌 해수부 차관, 북극항로 시범운항 ""막바지""…선박·화물 확보 마지...",http://www.fnnews.com/news/202607031023525316,"같은 이유로 얀부항을 통한 원유 수송도 제한적으로 운영 중이며, 원유운반선 10척 중 7척이 국내 입항을 마쳤고 3척이 항해 중이다. 이란의 호르무즈해협 통행료 부과 관측에는 ""확정되지 않은 사안에 답하긴 곤란하다... ",17
중동영향,2026-07-03,뉴시스,"호르무즈 원유 수입선 정상화는 언제…정부 ""아직 홍해 우선""",https://www.newsis.com/view/NISX20260702_0003693962,"다만 해협 통행료를 둘러싼 미국과 이란간 줄다리기가 이어지면서 전쟁 전 대표적 원유수입선이던 호르무즈 해협의 완전한 정상화까지는 시간이 걸릴 전망이다. 3일 해양수산부에 따르면, 전날(2일) 기준 호르무즈 해협... ",13
중동영향,2026-07-04,머니투데이,"일본, 이란 원유 수입 재개하나…제재 풀리자 업체 3곳 물밑 논의",https://www.mt.co.kr/world/2026/07/04/2026070414455161008,로이터통신은 이란 소식통 2명을 인용해 일본 업체 3곳이 2019년 이후 처음으로 이란산 원유 구매를 검토 중이라고 보도했다. 최근 이란은 미국과 종전 협상 MOU(양해각서)를 통해 원유 수출을 재개할 수 있게 됐다. 일본은... ,11
중동영향,2026-07-03,이데일리,"사우디, 美·이란 MOU 서명 후 호르무즈 원유수송 2배로",https://www.edaily.co.kr/news/newspath.asp?newsid=03388246645510912,(사진=AFP) 2일(현지시간) CNBC에 따르면 무역정보 업체 케플러(Kpler) 집계 결과 사우디는 지난달 17일 미·이란 양해각서(MOU) 체결 이후 호르무즈 해협을 통해 약 3400만배럴의 원유를 수송했다. 이는 이란의 공격으로... ,11
중동영향,2026-07-04,헤럴드경제,"“일본 기업 3곳, 이란산 원유 구매 협의 시작”",https://biz.heraldcorp.com/article/10798050?ref=naver,이후 이란 원유 주요 수입국은 중국이 됐다. 일본 측은 구매 결정 전 이란 측으로부터 유조선 안전을 보장받길 원하고 있어 실제 수입 재개까지는 시간이 필요할 것으로 보인다. 일본 경제산업성 관계자는 지난달 일본의... ,12
