category,date,source,title,link,description,hits
나프타,2026-07-24,파이낸셜뉴스,의료용 주사기 판매량 제한 해제…요소수·요소 매점매석 금지 1개월 연...,http://www.fnnews.com/news/202607231645442213,"현재 중동전쟁 영향으로 나프타 등 원료 수급불안에 따라 의료용 주사기·주사침의 매점매석행위를 금지하고 있다. 하지만 주사기 수급상황이 안정적이고 가수요 감소, 수입제품 대체 등 영향으로 6월 말부터 제조업체... ",37
나프타,2026-07-24,아시아경제,"구윤철 ""2%대 물가 총력…유류세 인하 연장하고 최고가격제 유지""(종합...",https://view.asiae.co.kr/article/2026072409434288619,"구 부총리는 중동전쟁 발발 이후 정부의 비상대응체계 가동으로 나프타, 요소 등 주요 원자재의 수급여건이 개선되고 주요국 대비 낮은 물가상승률을 기록하고 있다고 자평했다. 구 부총리는 ""2개월 연속 3%를 상회했던... ",16
나프타,2026-07-23,머니투데이,2분기 GDP 0.6%↑ '서프라이즈'…한은 전망치 3배,https://www.mt.co.kr/economy/2026/07/24/2026072310003476983,"이 국장은 ""관련 산업의 공급 차질로 생산과 고용에 부정적인 영향이 있었지만 나프타 수급 안정화와 비축유 스왑 등 정부 지원 정책, 수입선 다변화의 효과가 컸다""고 평가했다. 올해 2분기 실질 국내총소득(GDI)은 3.6... ",11
나프타,2026-07-23,파이낸셜뉴스,"샤힌 프로젝트, 울산 석유화학업계 'Oil-to-Chemical' 대전환 계기되나",http://www.fnnews.com/news/202607231448315104,특히 울산 내 중소·중견 화학 기업들은 글로벌 수급 악화 속에서 고물가와 고금리에 따른 극심한 재무... 나프타 수율을 기존 15%에서 70%까지 끌어올려 울산 지역 화학기업에 저렴하고 안정적인 원료 공급 기반을... ,10
나프타,2026-07-23,연합뉴스,2분기 한국 경제 0.6% '깜짝 성장'…연간 3% 돌파 가시권(종합),https://www.yna.co.kr/view/AKR20260723021151002?input=1195m,"이동원 한은 경제통계2국장은 ""중동 전쟁으로 생산 활동과 고용에 부정적 영향이 있었지만, 나프타 수급 안정화, 비축유 스와프 등 정부 지원 정책과 수입 다변화 영향이 매우 컸다""고 평가했다. 이 국장은 ""올해... ",8
나프타,2026-07-23,이데일리,여수 NCC 139만톤 멈춘다…석유화학 구조조정 ‘실행 단계’,https://www.edaily.co.kr/news/newspath.asp?newsid=02824086645517472,대산에 이어 여수 산업단지의 사업 재편안이 확정되면서 국내 나프타분해시설(NCC) 감축 규모는... “중장기적으로 수급 균형과 국내 업체들의 원가 경쟁력 개선이 기대된다”고 말했다. 이어 “앞으로 울산과 여수의... ,7
나프타,2026-07-23,뉴시스,"충남도, 반도체 덕에 1년치 수출 반년만에 돌파",https://www.newsis.com/view/NISX20260723_0003720911,"이처럼 도내 수출이 급증한 것은 AI 대전환 시대, 메모리반도체 수요가 크게 늘었기 때문으로... 주요 수입품은 원유 91억 1700만 달러, 나프타 16억 5600만 달러, 유연탄 16억 5200만 달러 등의 순이다. 수입... ",8
원유,2026-07-24,한겨레,"후티, 홍해서 유조선 공격…브렌트유 100달러 재돌파",https://www.hani.co.kr/arti/international/arabafrica/1269793.html,이는 사우디산 원유 수송을 막겠다고 밝힌 후티가 바브엘만데브해협에서 사우디 유조선 2척을 공격했다고 주장하면서 세계 원유 공급 차질에 대한 우려가 커진 영향으로 보인다. 호르무즈해협과 바브엘만데브해협을... ,25
원유,2026-07-24,파이낸셜뉴스,[뉴욕증시] 유가 100달러·AI '돈 먹는 하마' 공포…나스닥 2.15% 급락,http://www.fnnews.com/news/202607240723320083,국제 원유의 핵심 수송로인 호르무즈해협에 이어 홍해까지 불안해지면서 공급 차질 우려가 급속히 번졌다. 예멘의 친이란 무장세력 후티가 사우디아라비아를 겨냥해 홍해 봉쇄를 선언한 가운데 사우디 유조선 2척이... ,17
원유,2026-07-23,헤럴드경제,사우디 우라늄 농축 빗장 풀리나…중동 ‘핵 도미노’ 우려,https://biz.heraldcorp.com/article/10817640?ref=naver,두 기술 모두 원전 연료를 만드는 데 쓰이지만 핵무기용 핵물질을 생산하는 경로가 될 수도 있어 중동의... 이번 원자력 협정 역시 탄소배출을 줄이고 발전용으로 소비하는 원유를 수출로 돌리려는 ‘비전 2030’ 전략의... ,18
원유,2026-07-24,서울경제,"홍해 긴장 다시 고조…유가, 100달러 돌파 초읽기",https://www.sedaily.com/article/20071362?ref=naver,"시장에서는 홍해와 아덴만을 잇는 바브엘만데브 해협의 항행 차질이 현실화할 경우 글로벌 원유 공급망에 상당한 충격이 불가피할 것이라는 전망이 나온다. 2. “AI 수요 강력”…구글, 올해 300조 원 쏟아붓는다... ",13
원유,2026-07-23,연합뉴스,"EU, 희석된 대러 제재 강화안 합의…유가 상한선 동결",https://www.yna.co.kr/view/AKR20260723184100098?input=1195m,"AFP통신 등은 외교 소식통을 인용, 그리스의 반발을 무마하기 위해 역내 해운업체들이 북극 지역에서 생산된... 이번 합의에 따라, 현재 배럴당 44.10달러(약 6만5천원)로 설정된 러시아산 원유 가격 상한선이 1년간... ",13
원유,2026-07-23,이데일리,“기저효과에도 2분기 강한 성장…하반기 -0.1%면 연 3% 성장”[일문일...,https://www.edaily.co.kr/news/newspath.asp?newsid=03788406645517472,"나프타 수급 안정화와 비축유 활용, 수입선 다변화 등 정부 대응이 영향을 상당 부분 완화했다”고... 4%라는 이례적으로 높은 증가율을 기록했다”며 “중동 전쟁으로 원유를 중심으로 수입품 가격이 크게 상승했음에도... ",13
원유,2026-07-24,조선비즈,[경제 포커스] 국제 유가 100달러 돌파...韓銀 “성장률 2%초반으로 하락...,https://biz.chosun.com/policy/policy_sub/2026/07/24/GV7F7F32ZZHABK5YSMBKBQ3DTA/?utm_source=naver&utm_medium=original&utm_campaign=biz,원유 수입 의존도가 높은 우리나라는 국제 유가가 오르면 수입 물가가 상승해 성장률에도 부정적인 영향이... 국제 유가가 높은 수준에 계속 머물게 되면 글로벌 에너지 수급이 악화되면서 원자재 수입 의존도가 높은... ,8
중동영향,2026-07-24,한겨레,"후티, 홍해서 유조선 공격…브렌트유 100달러 재돌파",https://www.hani.co.kr/arti/international/arabafrica/1269793.html,이는 5월22일 이후 최고 종가로 2월 이란 전쟁 발발 당시보다 약 40% 오른 수준이다. 전쟁 발발 직후를 제외하고는 상승분 대부분이 이번 달에 발생했다. 미국 서부텍사스산원유(WTI) 9월물도 5.36달러(6.2%) 오른 배럴당 92.... ,78
중동영향,2026-07-24,헤럴드경제,"트럼프 “이란 역대 최대 공격 검토…결정 직전, 모든 준비 마쳤다”[1...",https://biz.heraldcorp.com/article/10818495?ref=naver,미국의 대이란 공습이 12일째 이어지는 가운데 이스라엘의 즉각적인 합류 가능성까지 언급하면서 중동... 사우디는 이란의 호르무즈 해협 봉쇄 이후 동부 유전에서 생산한 원유를 송유관을 통해 홍해 연안으로 보낸 뒤... ,62
중동영향,2026-07-24,서울경제TV,"뉴욕증시, 유가 급등·AI 투자 부담에 일제히 하락…나스닥 2.2%↓",https://www.sentv.co.kr/article/view/sentv202607240010,"9월 인도분 서부 텍사스산 원유(WTI) 선물은 6.17% 상승한 배럴당 92.19달러를 기록했다. 브렌트유는 5월 22일... 예멘 친이란 반군 후티는 사우디를 겨냥한 홍해 봉쇄를 선언한 데 이어, 전날 사우디 유조선 두 척... ",52
중동영향,2026-07-24,뉴스1,"트럼프 ""이란 동결자산으로 선박 피해 보상""…이란, 강력 반발(종합)",https://www.news1.kr/world/usa-canada/6238020,도널드 트럼프 미국 대통령이 이란과 친이란 세력의 공격으로 피해를 본 선박과 화물에 대한 보상에 미국이... 후티의 공격으로 호르무즈 해협에 이어 홍해까지 해상 운송 불안이 확산하면서 글로벌 원유 시장의 긴장도... ,49
중동영향,2026-07-24,경향신문,중동 정세 악화·고유가에 뉴욕증시 하락…나스닥 2.15%↓,https://www.khan.co.kr/article/202607240736001,"국제 원유의 주요 수송로인 호르무즈 해협의 통항 차질 우려에 더해 홍해에서도 사우디아라비아 유조선이 공격받으면서 공급 우려가 커졌다. 미국은 12일 연속 이란 공습을 이어갔고, 도널드 트럼프 미 대통령은... ",30
중동영향,2026-07-24,경향신문,"트럼프 “호르무즈 피격 선박, 이란 자금으로 보상할 것”",https://www.khan.co.kr/article/202607241003001,이란은 예멘의 친이란 대리 세력 후티 반군을 이용해 홍해 장악에 나섰다. 홍해는 호르무즈 해협 봉쇄 이후 사우디아라비아 등의 우회 원유 수송로로 활용됐다. 후티는 이날 사우디 유조선 두 척을 겨냥한 군사 작전을... ,28
중동영향,2026-07-24,뉴시스,"사우디, 후티 위협에 이집트 경유 원유 수출 확대",https://www.newsis.com/view/NISX20260724_0003721559,23일 사우디 유조선 엔셀리아호와 레일라호를 미사일과 드론으로 공격했다고 주장했다. 이에 따라 사우디는 이란과의 전쟁 이후 막혔던 호르무즈 해협에 이어 바브엘만데브 해협을 통한 원유 수출길까지 어려워진 상태다．,24
